{
  "$schema": "https://json-schema.org/draft/2020-12/schema",
  "additionalProperties": false,
  "properties": {
    "annotation": {
      "type": "string"
    },
    "basis": {
      "index": true,
      "type": "boolean"
    },
    "condition": {
      "enum": [
        "",
        "1b",
        "2b",
        "3b",
        "40",
        "4b",
        "5b",
        "6b",
        "80",
        "90"
      ],
      "index": true,
      "type": "string"
    },
    "created": {
      "type": "string"
    },
    "edit_comment": {
      "type": "string"
    },
    "edit_state": {
      "enum": [
        "",
        "Edited",
        "Review"
      ],
      "index": true,
      "type": "string"
    },
    "editor": {
      "type": "string"
    },
    "identifier": {
      "type": "string"
    },
    "location": {
      "type": "string"
    },
    "media": {
      "items": {
        "enum": [
          "Original",
          "Reproduktion"
        ],
        "type": "string"
      },
      "type": "array"
    },
    "owner": {
      "enum": [
        "",
        "Theodor Springmann Stiftung"
      ],
      "index": true,
      "type": "string"
    },
    "public": {
      "index": true,
      "type": "boolean"
    },
    "scans": {
      "items": {
        "type": "string"
      },
      "type": "array"
    },
    "updated": {
      "type": "string"
    },
    "uri": {
      "type": "string"
    }
  },
  "required": [],
  "type": "object",
  "x-index-paths": [
    "media[*]"
  ]
}
