{
  "annotation": "Jgg 1824-1831, 1832-1840",
  "condition": "",
  "created": "2026-06-11 10:17:37.569Z",
  "edit_comment": "",
  "edit_state": "Edited",
  "identifier": "404016",
  "location": "105A06",
  "media": [
    "Original"
  ],
  "owner": "Theodor Springmann Stiftung",
  "scans": [],
  "updated": "2026-06-11 10:17:37.569Z",
  "uri": "",
  "public": false,
  "basis": true,
  "editor": ""
}
