{
  "annotation": "§ Standort",
  "condition": "",
  "created": "2026-06-11 10:17:37.650Z",
  "edit_comment": "",
  "edit_state": "Edited",
  "identifier": "404897",
  "location": "105C07",
  "media": [
    "Original"
  ],
  "owner": "Theodor Springmann Stiftung",
  "scans": [],
  "updated": "2026-06-11 10:17:37.650Z",
  "uri": "",
  "public": false,
  "basis": true,
  "editor": ""
}
